{
  "schema_version": 1,
  "run": {
    "id": "2026-04-18T155257",
    "started_at": "2026-04-18T06:52:52Z",
    "finished_at": "2026-04-18T06:52:57Z",
    "environment": {
      "os": "Darwin 24.5.0",
      "clier_version": "dev",
      "auth_target": "@clier",
      "disposable_prefix": "qa-20260418155257",
      "modes_exercised": [
        "agent",
        "user"
      ]
    },
    "agent": {
      "kind": "claude"
    }
  },
  "exploration": {
    "summary": "First v1 report. Only one scripted scenario (skill create→delete). Exploration findings will accrue as the agent-as-consumer lens gets applied.",
    "findings": []
  },
  "scenarios": [
    {
      "id": "skill.create-and-delete",
      "title": "Scenario — create skill, confirm, delete, confirm gone",
      "source": "script",
      "status": "error",
      "evidence": {
        "kind": "scenario",
        "precondition": "authenticated clier session; target name not yet taken",
        "expected_outcome": "skill appears after create; not-found after delete",
        "actual_outcome": "setup failed: create returned 1",
        "steps": [
          {
            "role": "action",
            "label": "Create skill",
            "status": "error",
            "command": "clier create skill --name qa-hello-20260418155256 ...",
            "exit_code": 1,
            "stderr_excerpt": "{\"error\":{\"kind\":\"auth_required\",\"message\":\"authentication required\",\"hint\":\"run 'clier auth login' to sign in\"}}",
            "duration_ms": 68,
            "error_detail": "create exited 1"
          }
        ]
      },
      "error_detail": "create skill failed — {\"error\":{\"kind\":\"auth_required\",\"message\":\"authentication required\",\"hint\":\"run 'clier auth login' to sign in\"}}"
    }
  ]
}
